,user,tweet,stem,label,tokenizing
266,Mayang Aulia Mayang Aulia,Mustinya suruh aja yang jambak yang pasang infus jadi sebel liat kelakuannya,mustinya suruh aja jambak pasang infus sebel liat laku,0,"['mustinya', 'suruh', 'aja', 'yang', 'jambak', 'yang', 'pasang', 'infus', 'jadi', 'sebel', 'liat', 'kelakuannya']"
267,Dedy M,Itu bapak yg pkai topi spertinya udah nyiapin meterai 10rb dikantongnya...,pkai topi spertinya udah nyiapin meterai rb kantong,0,"['itu', 'bapak', 'yg', 'pkai', 'topi', 'spertinya', 'udah', 'nyiapin', 'meterai', 'rb', 'dikantongnya']"
268,Tondi Sipangkar,Ternyata cuma berdarah saat perawat lepas infus anaknya. Barusan cari tau kronologinya di portal2 berita lainnya.,darah awat lepas infus anak barusan cari tau kronologi portal berita,-1,"['ternyata', 'cuma', 'berdarah', 'saat', 'perawat', 'lepas', 'infus', 'anaknya', 'barusan', 'cari', 'tau', 'kronologinya', 'di', 'portal', 'berita', 'lainnya']"
269,Sunjaya,"Udah karungin aja,,org arogan kya gt g patut diksih kata maaf,,",udah karungin aja org arogan kya gt patut diksih maaf,1,"['udah', 'karungin', 'aja', 'org', 'arogan', 'kya', 'gt', 'g', 'patut', 'diksih', 'kata', 'maaf']"
270,Kristiana Joana,Tp kadang emang ada perawat yg kyk GT...yg dsalahkan mlh pasiennya...yg dblng ga mau lemeslah ini itu...pasiene dimarahi...,kadang emang awat kyk gt dsalahkan mlh pasien dblng ga lemes pasiene marah,0,"['tp', 'kadang', 'emang', 'ada', 'perawat', 'yg', 'kyk', 'gt', 'yg', 'dsalahkan', 'mlh', 'pasiennya', 'yg', 'dblng', 'ga', 'mau', 'lemeslah', 'ini', 'itu', 'pasiene', 'dimarahi']"
271,Muchamad Rifani,Perawat itu manusia bs salah. Aplg mslah cucuk infus g smudah itu cari pmbluh darahnya.,awat manusia bs salah aplg mslah cucuk infus smudah cari pmbluh darah,-1,"['perawat', 'itu', 'manusia', 'bs', 'salah', 'aplg', 'mslah', 'cucuk', 'infus', 'g', 'smudah', 'itu', 'cari', 'pmbluh', 'darahnya']"
272,RoRo Febbyana,Tugas sekurity ngapainn cuma nonton??,tugas sekurity ngapainn nonton,0,"['tugas', 'sekurity', 'ngapainn', 'cuma', 'nonton']"
273,Azhari Achmad,Pas diciduk polisi baru nangis nangis minta maaf,pas ciduk polisi nang nang maaf,1,"['pas', 'diciduk', 'polisi', 'baru', 'nangis', 'nangis', 'minta', 'maaf']"
274,Lis Syaudah,Di tuntut aja ..orang kya gitu,tuntut aja orang kya gitu,0,"['di', 'tuntut', 'aja', 'orang', 'kya', 'gitu']"
275,Edy Haryanto,"Sama pk wnak sy jg pernah ngalamin yg sama,kaki bengkak,infusnya nggak masuk,amatir perawatnya",pk wnak sy ngalamin kaki bengkak infus nggak masuk amatir awat,-1,"['sama', 'pk', 'wnak', 'sy', 'jg', 'pernah', 'ngalamin', 'yg', 'sama', 'kaki', 'bengkak', 'infusnya', 'nggak', 'masuk', 'amatir', 'perawatnya']"
276,Anjas Kopa,Tepuk tangan buat baju merahh,tepuk tangan baju merahh,0,"['tepuk', 'tangan', 'buat', 'baju', 'merahh']"
277,Spectrum ID,"Istriq diambil darah,smp 8x baru dpt, dah istriq takut jarum suntik.. gk tau kesalahan dr perawat atau letak lokasi darah istriq yg susah dicari",istriq ambil darah smp dpt dah istriq takut jarum suntik gk tau salah dr awat letak lokasi darah istriq susah cari,-1,"['istriq', 'diambil', 'darah', 'smp', 'x', 'baru', 'dpt', 'dah', 'istriq', 'takut', 'jarum', 'suntik', 'gk', 'tau', 'kesalahan', 'dr', 'perawat', 'atau', 'letak', 'lokasi', 'darah', 'istriq', 'yg', 'susah', 'dicari']"
278,Raditya Parno,Meski dia polisi beneran msk harus sewenang gitu. Hukum aja pak seadil2nya. Biar ndak krg ajar lagi,polisi beneran msk wenang gitu hukum aja adil biar ndak krg ajar,0,"['meski', 'dia', 'polisi', 'beneran', 'msk', 'harus', 'sewenang', 'gitu', 'hukum', 'aja', 'pak', 'seadilnya', 'biar', 'ndak', 'krg', 'ajar', 'lagi']"
279,Gunawan Wawan,Itu lah resikony klu ank2 memang susah tapi y mau gymn lg...harus tetep d infus tapi biasa ny ad yg ahli ny setiap RS ...,resikony klu ank susah y gymn lg tetep d infus ny ad ahli ny rs,0,"['itu', 'lah', 'resikony', 'klu', 'ank', 'memang', 'susah', 'tapi', 'y', 'mau', 'gymn', 'lg', 'harus', 'tetep', 'd', 'infus', 'tapi', 'biasa', 'ny', 'ad', 'yg', 'ahli', 'ny', 'setiap', 'rs']"
280,PanLara,Nanti liat vidio klarifkasinya apakah bpk masih segarang ini?,liat vidio klarifkasinya bpk garang,-1,"['nanti', 'liat', 'vidio', 'klarifkasinya', 'apakah', 'bpk', 'masih', 'segarang', 'ini']"
281,Aan Mulyawan,Anakku jam 11 siang ampek sore gak bs dipasang infus dan akhirnya operasi dikaki untuk pasang infus.... Aq aja tanda tanggan kok,anak jam siang ampek sore bs pasang infus operasi kaki pasang infus aq aja tanda tanggan,1,"['anakku', 'jam', 'siang', 'ampek', 'sore', 'gak', 'bs', 'dipasang', 'infus', 'dan', 'akhirnya', 'operasi', 'dikaki', 'untuk', 'pasang', 'infus', 'aq', 'aja', 'tanda', 'tanggan', 'kok']"
282,Hermawan Agung Wibowo,"Itu orang kaya pinter tapi tidak punya etika, karena merasa sudah bayar dan emosinya yg digedein",orang kaya pinter etika bayar emosi digedein,1,"['itu', 'orang', 'kaya', 'pinter', 'tapi', 'tidak', 'punya', 'etika', 'karena', 'merasa', 'sudah', 'bayar', 'dan', 'emosinya', 'yg', 'digedein']"
283,Rifarifa II,Sama adek saya dulu juga gitu suster gk bisa pasang infus sampek berdarah darah dan sakit sekarang tanganya mati rasa,adek gitu suster gk pasang infus sampek darah darah sakit tanganya mati,-1,"['sama', 'adek', 'saya', 'dulu', 'juga', 'gitu', 'suster', 'gk', 'bisa', 'pasang', 'infus', 'sampek', 'berdarah', 'darah', 'dan', 'sakit', 'sekarang', 'tanganya', 'mati', 'rasa']"
284,Suhendar Suhe,Tidak mungkin semarah itu kl tidak ada penyebab lain,marah kl sebab,-1,"['tidak', 'mungkin', 'semarah', 'itu', 'kl', 'tidak', 'ada', 'penyebab', 'lain']"
285,Atiqah,Itu kok petugas keamanannya diam aja waktu perawatnya lagi di tarik sama yg pake baju merah,tugas aman diam aja awat tarik pake baju merah,1,"['itu', 'kok', 'petugas', 'keamanannya', 'diam', 'aja', 'waktu', 'perawatnya', 'lagi', 'di', 'tarik', 'sama', 'yg', 'pake', 'baju', 'merah']"
286,Nuryanti Akbar,Aku juga di infus berdarah dan sakit trus pindah ketangan satu nya berdarah lagi trus sama susternya di tarik infusnya di pasang lagi. Wajar x yaa klu di infus berdarah. GK usah pke kekerasan gitu apalagi sama perempuan.,infus darah sakit trus pindah ketang darah trus suster tarik infus pasang wajar yaa klu infus darah gk pke keras gitu perempuan,-1,"['aku', 'juga', 'di', 'infus', 'berdarah', 'dan', 'sakit', 'trus', 'pindah', 'ketangan', 'satu', 'nya', 'berdarah', 'lagi', 'trus', 'sama', 'susternya', 'di', 'tarik', 'infusnya', 'di', 'pasang', 'lagi', 'wajar', 'x', 'yaa', 'klu', 'di', 'infus', 'berdarah', 'gk', 'usah', 'pke', 'kekerasan', 'gitu', 'apalagi', 'sama', 'perempuan']"
287,M Tohar Banega,Anaknya dehidrasi kali tu makanya susah di infus.,anak dehidrasi kali susah infus,-1,"['anaknya', 'dehidrasi', 'kali', 'tu', 'makanya', 'susah', 'di', 'infus']"
288,Elmira Susanto,Suruh pasang sediri klu tidak trima....,suruh pasang diri klu trima,0,"['suruh', 'pasang', 'sediri', 'klu', 'tidak', 'trima']"
289,Wsu Utomo,Ibu2 Baju merah lagi marah. Ya sampai aniaya perawat. Klu laki2 gak mungkin kyk gtu Berani sama perempuan. Ya bisa d simpulkan sendiri kyk apa orang yg pakai koas merah ini.,baju merah marah ya aniaya awat klu laki kyk gtu berani perempuan ya d simpul kyk orang pakai koas merah,-1,"['ibu', 'baju', 'merah', 'lagi', 'marah', 'ya', 'sampai', 'aniaya', 'perawat', 'klu', 'laki', 'gak', 'mungkin', 'kyk', 'gtu', 'berani', 'sama', 'perempuan', 'ya', 'bisa', 'd', 'simpulkan', 'sendiri', 'kyk', 'apa', 'orang', 'yg', 'pakai', 'koas', 'merah', 'ini']"
290,Betti Herlika,Diingat wajah nya dan keluarganya jd saat dia sakit surih berobat sendiri jgn dilayani,wajah keluarga jd sakit surih obat jgn layan,-1,"['diingat', 'wajah', 'nya', 'dan', 'keluarganya', 'jd', 'saat', 'dia', 'sakit', 'surih', 'berobat', 'sendiri', 'jgn', 'dilayani']"
291,Korak Putra Irgi,Anak saya yg 14 HR di infus jg keluar darah aq jg gak segitunya ...BLH cemas tp setidaknya di pertanyakn dulu gak perlu pakai ego dan emosi,anak hr infus darah aq segitunya blh cemas pertanyakn pakai ego emosi,0,"['anak', 'saya', 'yg', 'hr', 'di', 'infus', 'jg', 'keluar', 'darah', 'aq', 'jg', 'gak', 'segitunya', 'blh', 'cemas', 'tp', 'setidaknya', 'di', 'pertanyakn', 'dulu', 'gak', 'perlu', 'pakai', 'ego', 'dan', 'emosi']"
292,Baba Noeldesaza,Mana sapamnya ?rumah sakit d bkin tempat ribut emang udh pada sehat.,sapamnya rumah sakit d bkin ribut emang udh sehat,-1,"['mana', 'sapamnya', 'rumah', 'sakit', 'd', 'bkin', 'tempat', 'ribut', 'emang', 'udh', 'pada', 'sehat']"
293,Afif Wahyu Pratama,paling nangis tua nnti yg baju merah...ujung2nya klarifikasi minta maaf,nang tua nnti baju merah ujung klarifikasi maaf,1,"['paling', 'nangis', 'tua', 'nnti', 'yg', 'baju', 'merah', 'ujungnya', 'klarifikasi', 'minta', 'maaf']"
294,Muhammad Riza,"Terkecuali anak nya keturunan setan,jin,hantu belau, kalau gak mau berdarah.alias gak punya darah.",kecuali anak turun setan jin hantu belau darah alias darah,-1,"['terkecuali', 'anak', 'nya', 'keturunan', 'setan', 'jin', 'hantu', 'belau', 'kalau', 'gak', 'mau', 'berdarah', 'alias', 'gak', 'punya', 'darah']"
295,Rininta Aphoy Maharani,"Apapun alasannya memakai kekerasan itu salah,  kalo kesal kn bisa ya cuma dibentak atau di marahi dan laporin ke manager rs nya",apa alas pakai keras salah kalo kesal kn ya bentak marah laporin manager rs,-1,"['apapun', 'alasannya', 'memakai', 'kekerasan', 'itu', 'salah', 'kalo', 'kesal', 'kn', 'bisa', 'ya', 'cuma', 'dibentak', 'atau', 'di', 'marahi', 'dan', 'laporin', 'ke', 'manager', 'rs', 'nya']"
296,Ririk Agus Hariyanto,"Anak kecil kan kan emang susah di infus,pembuluh darahnya kecil,dulu anakq aja tangan kanan kiri diinfus gak bisa²,akhirnya dinfus di kaki",anak emang susah infus buluh darah anakq aja tangan kanan kiri infus dinfus kaki,0,"['anak', 'kecil', 'kan', 'kan', 'emang', 'susah', 'di', 'infus', 'pembuluh', 'darahnya', 'kecil', 'dulu', 'anakq', 'aja', 'tangan', 'kanan', 'kiri', 'diinfus', 'gak', 'bisa', 'akhirnya', 'dinfus', 'di', 'kaki']"
297,Ardany Zulfiqar,Wajarlah ortunya marah.... makanya kalau pas lagi pasang infus hrs bener2 fokus.,wajar ortunya marah pas pasang infus hrs bener fokus,-1,"['wajarlah', 'ortunya', 'marah', 'makanya', 'kalau', 'pas', 'lagi', 'pasang', 'infus', 'hrs', 'bener', 'fokus']"
298,Bandi,Lu polisi. Gw penjual materai.,lu polisi jual materai,0,"['lu', 'polisi', 'gw', 'penjual', 'materai']"
299,Patar Lumban Tobing,"Itu satpam RS ngapain ya, malahan nontonin aje.",satpam rs ngapain ya nontonin aje,0,"['itu', 'satpam', 'rs', 'ngapain', 'ya', 'malahan', 'nontonin', 'aje']"
300,Leo Waldiansyah,di coment ini sepertinya pada kagak baca ya ko comentnya masang infus..bukanya kejadian disini saat mencabut infusya?,coment kagak baca ya ko comentnya masang infus buka jadi cabut infusya,0,"['di', 'coment', 'ini', 'sepertinya', 'pada', 'kagak', 'baca', 'ya', 'ko', 'comentnya', 'masang', 'infus', 'bukanya', 'kejadian', 'disini', 'saat', 'mencabut', 'infusya']"
301,Fachri Arief,"Makax dituntut perawat yg handal...aplg saat pasang infus..saya bolak,balik rs. Pasti ada perawat  muda yg kerja asal.maaf.",makax tuntut awat handal aplg pasang infus bolak rs awat muda kerja maaf,1,"['makax', 'dituntut', 'perawat', 'yg', 'handal', 'aplg', 'saat', 'pasang', 'infus', 'saya', 'bolak', 'balik', 'rs', 'pasti', 'ada', 'perawat', 'muda', 'yg', 'kerja', 'asal', 'maaf']"
302,Julian Julian,"sabar bos jangan main pkul z,, klu udh masuk sel u baru nyesel,, ngomng.a khilaf..",sabar bos main pkul z klu udh masuk sel u nyesel ngomng a khilaf,0,"['sabar', 'bos', 'jangan', 'main', 'pkul', 'z', 'klu', 'udh', 'masuk', 'sel', 'u', 'baru', 'nyesel', 'ngomng', 'a', 'khilaf']"
303,Nanaywolles,Huh..gua rassa perawat nya msh dlm thap belajar..dn biasa nya di bikin uni prktek ke si pasiien....,huh gua rassa awat msh dlm thap ajar dn bikin uni prktek si pasiien,-1,"['huh', 'gua', 'rassa', 'perawat', 'nya', 'msh', 'dlm', 'thap', 'belajar', 'dn', 'biasa', 'nya', 'di', 'bikin', 'uni', 'prktek', 'ke', 'si', 'pasiien']"
304,DestHa,Palingan ujung2 nya mntak maaf kayak yang sudah2,paling ujung mntak maaf kayak,1,"['palingan', 'ujung', 'nya', 'mntak', 'maaf', 'kayak', 'yang', 'sudah']"
305,Eka Winahok,Dirmh j dirmh sakit nyusahin orang nanti apa 2 main pukul,dirmh j dirmh sakit nyusahin orang main,-1,"['dirmh', 'j', 'dirmh', 'sakit', 'nyusahin', 'orang', 'nanti', 'apa', 'main', 'pukul']"
306,Tongeret Janari Tongeret,"Ini masalahnya beda lagi ea, biasanya ribut corona gak henti henti, ini penganiayaan, ada aja ea masalah,",beda ea ribut corona henti henti aniaya aja ea,-1,"['ini', 'masalahnya', 'beda', 'lagi', 'ea', 'biasanya', 'ribut', 'corona', 'gak', 'henti', 'henti', 'ini', 'penganiayaan', 'ada', 'aja', 'ea', 'masalah']"
307,Anton Gama Al Farizi,Bapa pke baju merah hmmm bngt ga malu ya,bapa pke baju merah hmmm bngt ga malu ya,-1,"['bapa', 'pke', 'baju', 'merah', 'hmmm', 'bngt', 'ga', 'malu', 'ya']"
308,Zulpan Aries,Sy di impus 4x cucuk sampai patah2 jarum nya.....sy tenang aja....,sy impus cucuk patah jarum sy tenang aja,0,"['sy', 'di', 'impus', 'x', 'cucuk', 'sampai', 'patah', 'jarum', 'nya', 'sy', 'tenang', 'aja']"
309,Anggun Kayla,"Terkadang perawat yg masih magang di suruh suruh nanganin pasien,hadehhh.... Gak bisa nyalahin siapa yg salah dan yg benar,",terkadang awat magang suruh suruh nanganin pasien hadehhh nyalahin salah,0,"['terkadang', 'perawat', 'yg', 'masih', 'magang', 'di', 'suruh', 'suruh', 'nanganin', 'pasien', 'hadehhh', 'gak', 'bisa', 'nyalahin', 'siapa', 'yg', 'salah', 'dan', 'yg', 'benar']"
310,Kenzie Bradley,Sepertinya seorg aparat ya yg bju merah ? Sempat erucap saya polisi,seorg aparat ya bju merah erucap polisi,0,"['sepertinya', 'seorg', 'aparat', 'ya', 'yg', 'bju', 'merah', 'sempat', 'erucap', 'saya', 'polisi']"
311,Rsa,tdk mungkin dia emosi kl tdk ada sebabnya.tau sendri gmana pra perawat kita ini.apa lg hadapi pasien miskin waduh,emosi kl tau sendri gmana pra awat lg hadap pasien miskin,0,"['tdk', 'mungkin', 'dia', 'emosi', 'kl', 'tdk', 'ada', 'sebabnya', 'tau', 'sendri', 'gmana', 'pra', 'perawat', 'kita', 'ini', 'apa', 'lg', 'hadapi', 'pasien', 'miskin', 'waduh']"
312,A.M Nurjali,Itu orang udah kaya bang jago... Kita liat kisahnya. Di penjara..nangis nyesel,orang udah kaya bang jago liat kisah penjara nang nyesel,0,"['itu', 'orang', 'udah', 'kaya', 'bang', 'jago', 'kita', 'liat', 'kisahnya', 'di', 'penjara', 'nangis', 'nyesel']"
313,Yolanda Adnan,Ini sih terlalu,sih,0,"['ini', 'sih', 'terlalu']"
314,Nakashima Syahputra,Saya salah denger ato gmn ya pelaku bilang klo dia polisi,salah denger ato gmn ya laku bilang klo polisi,-1,"['saya', 'salah', 'denger', 'ato', 'gmn', 'ya', 'pelaku', 'bilang', 'klo', 'dia', 'polisi']"
315,Lius Kurnelius,"Halah paleng jga kalo di laporin ke polisi ujung2 nya "" Saya minta maaf karna khilaf "" Pret lah permainan anak kecil basi loh",halah paleng jga kalo laporin polisi ujung maaf karna khilaf pret main anak basi loh,0,"['halah', 'paleng', 'jga', 'kalo', 'di', 'laporin', 'ke', 'polisi', 'ujung', 'nya', 'saya', 'minta', 'maaf', 'karna', 'khilaf', 'pret', 'lah', 'permainan', 'anak', 'kecil', 'basi', 'loh']"
316,Abdul Rahmat Rasid,Ngak taj gimana kejadiannya kalo anaknya jatu ampe berdarah bisa bisa jalanna dia bantai sampe ancur atau kebaliaknnya,ngak taj gimana jadi kalo anak jatu ampe darah jalanna bantai sampe ancur kebaliaknnya,0,"['ngak', 'taj', 'gimana', 'kejadiannya', 'kalo', 'anaknya', 'jatu', 'ampe', 'berdarah', 'bisa', 'bisa', 'jalanna', 'dia', 'bantai', 'sampe', 'ancur', 'atau', 'kebaliaknnya']"
317,Herzza Zââ,Saya pernah sampe 5 kali pindah infus aja biasa aja tuh ngga sampe kaya begitu,sampe kali pindah infus aja aja tuh sampe kaya,1,"['saya', 'pernah', 'sampe', 'kali', 'pindah', 'infus', 'aja', 'biasa', 'aja', 'tuh', 'ngga', 'sampe', 'kaya', 'begitu']"
318,Abu Tamami,Mungkin perawatnya lelah...tapi ga perlu pake dijambak juga kaleeee....,awat lelah ga pake jambak kaleeee,-1,"['mungkin', 'perawatnya', 'lelah', 'tapi', 'ga', 'perlu', 'pake', 'dijambak', 'juga', 'kaleeee']"
319,Rifki,Pertanyaan itu ada security buat apa?,security,0,"['pertanyaan', 'itu', 'ada', 'security', 'buat', 'apa']"
320,Fatih Ramadhana,Kalo ngga berdarah namanya pasang kabel antena pak,kalo darah nama pasang kabel antena,0,"['kalo', 'ngga', 'berdarah', 'namanya', 'pasang', 'kabel', 'antena', 'pak']"
321,Mitra Chan,Itu security di situ ngapain aj? Percuma ada security kalo kejadian kayak itu dibiarkan.,security situ ngapain aj security kalo jadi kayak biar,0,"['itu', 'security', 'di', 'situ', 'ngapain', 'aj', 'percuma', 'ada', 'security', 'kalo', 'kejadian', 'kayak', 'itu', 'dibiarkan']"
322,Muhammad Ulin Nuha,Berdarah itu bisa juga krna anaknya terlalu banyak gerak juga bisa,darah krna anak gerak,0,"['berdarah', 'itu', 'bisa', 'juga', 'krna', 'anaknya', 'terlalu', 'banyak', 'gerak', 'juga', 'bisa']"
323,Suci Aprilia Puteri,Security-nya kek patung manekin,security patung manekin,-1,"['security', 'nya', 'kek', 'patung', 'manekin']"
324,Al Kasyafa,"Pengen liat endingnya, apakah kira2 cukup dengan materai?",ken liat endingnya materai,0,"['pengen', 'liat', 'endingnya', 'apakah', 'kira', 'cukup', 'dengan', 'materai']"
325,Kukuh Firman Pambudi,Gw yang mau di ambil darah nya pake suntik aja di ulang sampe 4x gara² ga pas di pembuluh darah nya ga selebay itu,ambil darah pake suntik aja ulang sampe gara ga pas buluh darah ga selebay,-1,"['gw', 'yang', 'mau', 'di', 'ambil', 'darah', 'nya', 'pake', 'suntik', 'aja', 'di', 'ulang', 'sampe', 'x', 'gara', 'ga', 'pas', 'di', 'pembuluh', 'darah', 'nya', 'ga', 'selebay', 'itu']"
326,De Vhirgie,Dmn2 orang skit kwi py2 judul ny yo sakit ..,dmn orang skit kwi py judul ny yo sakit,-1,"['dmn', 'orang', 'skit', 'kwi', 'py', 'judul', 'ny', 'yo', 'sakit']"
327,Rydo Fiaala,Keluarin anaknya dari rumah sakit.,keluarin anak rumah sakit,-1,"['keluarin', 'anaknya', 'dari', 'rumah', 'sakit']"
328,Sara Pawitra,"Ini akun bikin caption kurang vitamin,,",akun bikin caption vitamin,0,"['ini', 'akun', 'bikin', 'caption', 'kurang', 'vitamin']"
329,Andrea Antonio,Yg punya pengalaman dgn perawat yg ga becus pasang infus baru tau video ini....,alam dgn awat ga becus pasang infus tau video,0,"['yg', 'punya', 'pengalaman', 'dgn', 'perawat', 'yg', 'ga', 'becus', 'pasang', 'infus', 'baru', 'tau', 'video', 'ini']"
330,Nungky Anggraheni,Bapakku baru meninggal dmn kamu taruk barangku,bapak tinggal dmn taruk barang,0,"['bapakku', 'baru', 'meninggal', 'dmn', 'kamu', 'taruk', 'barangku']"
331,Andy,Yg sering donor darah bakal ketawa liat nya ni,donor darah ketawa liat ni,0,"['yg', 'sering', 'donor', 'darah', 'bakal', 'ketawa', 'liat', 'nya', 'ni']"
332,Bintangibuk,Ya nmanya diinfus pasti kluar darahnya lah pak.... Klo g mau dtusuk cm dpegang2 aj tu bawa kedukun pak...,ya nmanya infus kluar darah klo dtusuk cm dpegang aj bawa dukun,-1,"['ya', 'nmanya', 'diinfus', 'pasti', 'kluar', 'darahnya', 'lah', 'pak', 'klo', 'g', 'mau', 'dtusuk', 'cm', 'dpegang', 'aj', 'tu', 'bawa', 'kedukun', 'pak']"
333,Ismiyah Mia,Itu sekuriti bukan bantuin planga plongo doang,sekuriti bantuin planga plongo doang,0,"['itu', 'sekuriti', 'bukan', 'bantuin', 'planga', 'plongo', 'doang']"
334,Karaeng Pirri,"suruh org tuax yg pasang infus.sampah semua,",suruh org tuax pasang infus sampah,-1,"['suruh', 'org', 'tuax', 'yg', 'pasang', 'infus', 'sampah', 'semua']"
335,Apt Vins,pria bersafari security kah???? kok hanya nonton dan pegang pintu????,pria safar security kah nonton pegang pintu,0,"['pria', 'bersafari', 'security', 'kah', 'kok', 'hanya', 'nonton', 'dan', 'pegang', 'pintu']"
336,Eca Aldjokdja,Nich sekuriti tugasnya apa cuma liat liat aja ngak da tindakan ssama sekali,nich sekuriti tugas liat liat aja ngak da tindak ssama,0,"['nich', 'sekuriti', 'tugasnya', 'apa', 'cuma', 'liat', 'liat', 'aja', 'ngak', 'da', 'tindakan', 'ssama', 'sekali']"
337,Den Wo Wara Wiri,Itu securitinya ngapain?kok cm liat aja hadeeh.......,securitinya ngapain cm liat aja hadeeh,0,"['itu', 'securitinya', 'ngapain', 'kok', 'cm', 'liat', 'aja', 'hadeeh']"
338,Nungky Anggraheni,Aku msh pny nyawa km pun juga msh pny nyawa dmn kamu bawa barang aku semua,msh pny nyawa km msh pny nyawa dmn bawa barang,0,"['aku', 'msh', 'pny', 'nyawa', 'km', 'pun', 'juga', 'msh', 'pny', 'nyawa', 'dmn', 'kamu', 'bawa', 'barang', 'aku', 'semua']"
339,Nungky Anggraheni,Maaf aku gak mau panjang lebar tujuh point saja bawa semua barang aku,maaf lebar tujuh point bawa barang,1,"['maaf', 'aku', 'gak', 'mau', 'panjang', 'lebar', 'tujuh', 'point', 'saja', 'bawa', 'semua', 'barang', 'aku']"
340,Alex Chelsea,Emang klo polisi bisa arogan gitu pak...saya aja dari kluarga besar KOSTRAD biasa aja...harus nya marah boleh tapi jangan main tangan pa lagi ma cewek...laporin ke PROPAM POLDA setempat...jangan mau di 86...atau matrai 6 ribu..PROSES,emang klo polisi arogan gitu aja kluarga kostrad aja marah main tangan pa ma cewek laporin propam polda matra ribu proses,-1,"['emang', 'klo', 'polisi', 'bisa', 'arogan', 'gitu', 'pak', 'saya', 'aja', 'dari', 'kluarga', 'besar', 'kostrad', 'biasa', 'aja', 'harus', 'nya', 'marah', 'boleh', 'tapi', 'jangan', 'main', 'tangan', 'pa', 'lagi', 'ma', 'cewek', 'laporin', 'ke', 'propam', 'polda', 'setempat', 'jangan', 'mau', 'di', 'atau', 'matrai', 'ribu', 'proses']"
341,Aqilah Yunet Setiawan,"kita tunggu berita selanjutnya,dia minta maaf,dimaafkan saja,tapi hukum tetap berlaku,kan tindak penganiayaan",tunggu berita maaf maaf hukum laku tindak aniaya,1,"['kita', 'tunggu', 'berita', 'selanjutnya', 'dia', 'minta', 'maaf', 'dimaafkan', 'saja', 'tapi', 'hukum', 'tetap', 'berlaku', 'kan', 'tindak', 'penganiayaan']"
342,Fan Panjaitan,Tenangg Materai 6ribu bisa buat nyelesain tuh mslh,tenangg materai ribu nyelesain tuh mslh,0,"['tenangg', 'materai', 'ribu', 'bisa', 'buat', 'nyelesain', 'tuh', 'mslh']"
343,Lenon Saputra,klu kularga ku di bikin kaya gitu yng baju merah pasti kan kubalas.,klu kularga ku bikin kaya gitu yng baju merah balas,1,"['klu', 'kularga', 'ku', 'di', 'bikin', 'kaya', 'gitu', 'yng', 'baju', 'merah', 'pasti', 'kan', 'kubalas']"
344,Hendrick Wildan N S,Mudah mudahan pihak rumah sakit melindungi karywan nya dan segera menuntut si bapak tidak punya adab itu,mudah mudah rumah sakit lindung karywan tuntut si adab,1,"['mudah', 'mudahan', 'pihak', 'rumah', 'sakit', 'melindungi', 'karywan', 'nya', 'dan', 'segera', 'menuntut', 'si', 'bapak', 'tidak', 'punya', 'adab', 'itu']"
345,Awong Candra,Itu yg baju item astaga misahin kek tai,baju item astaga misahin tai,-1,"['itu', 'yg', 'baju', 'item', 'astaga', 'misahin', 'kek', 'tai']"
346,Rio,"Btw, itu yang kaos merah bukan anggota, tapi yang baju abu² itu anggota",btw kaos merah anggota baju abu anggota,0,"['btw', 'itu', 'yang', 'kaos', 'merah', 'bukan', 'anggota', 'tapi', 'yang', 'baju', 'abu', 'itu', 'anggota']"
347,Nungky Anggraheni,Aku gk pny mslh sm km dmn brg aku semua tinggal jwb sj,gk pny mslh sm km dmn brg tinggal jwb sj,0,"['aku', 'gk', 'pny', 'mslh', 'sm', 'km', 'dmn', 'brg', 'aku', 'semua', 'tinggal', 'jwb', 'sj']"
348,Saputra Kusuma,"Apa gunanya  satpam itu ga melerai diem doang, anjim keringet dingin satpamnye",guna satpam ga lerai diem doang anjim keringet dingin satpamnye,-1,"['apa', 'gunanya', 'satpam', 'itu', 'ga', 'melerai', 'diem', 'doang', 'anjim', 'keringet', 'dingin', 'satpamnye']"
349,Maulana,Untung gw dulu gk marah marah,untung gk marah marah,-1,"['untung', 'gw', 'dulu', 'gk', 'marah', 'marah']"
350,Nungky Anggraheni,Aku sudah gak punya ortu lengkap knp km masih tancap gak mau berhenti,ortu lengkap knp km tancap henti,-1,"['aku', 'sudah', 'gak', 'punya', 'ortu', 'lengkap', 'knp', 'km', 'masih', 'tancap', 'gak', 'mau', 'berhenti']"
351,Putri Lia,Itu yg baju merah yg bilang polisi sy kira yg mukul,baju merah bilang polisi sy mukul,0,"['itu', 'yg', 'baju', 'merah', 'yg', 'bilang', 'polisi', 'sy', 'kira', 'yg', 'mukul']"
352,Teuku Ardi,"Ada satpam lemah ,goblok , , saya salut sama baoak yang pakek.baju kaos putih , , terima kasih pak , ,",satpam lemah goblok salut baoak pakek baju kaos putih terima kasih,1,"['ada', 'satpam', 'lemah', 'goblok', 'saya', 'salut', 'sama', 'baoak', 'yang', 'pakek', 'baju', 'kaos', 'putih', 'terima', 'kasih', 'pak']"
353,Satya Ariwahyuni,itu yg baju safari item security bukan sih? security nya ga ada guna amat,baju safari item security sih security ga,0,"['itu', 'yg', 'baju', 'safari', 'item', 'security', 'bukan', 'sih', 'security', 'nya', 'ga', 'ada', 'guna', 'amat']"
354,Dody Kustanto,Jarum infusnya tusuk dari lehernya apa matanya ajh sekalian dari pada laki ngeselin.,jarum infus tusuk leher mata ajh laki ngeselin,0,"['jarum', 'infusnya', 'tusuk', 'dari', 'lehernya', 'apa', 'matanya', 'ajh', 'sekalian', 'dari', 'pada', 'laki', 'ngeselin']"
355,Yusjohanbay,Komunikasi yg kurang baik antara perawat & kluarga pasien .,komunikasi awat kluarga pasien,1,"['komunikasi', 'yg', 'kurang', 'baik', 'antara', 'perawat', 'kluarga', 'pasien']"
356,Dwi Mbendil,"Iki itu pak kapolri ada buah sok sok jagoan tlg di tindakan lanjut i,jangan mentang punya pangkat jabatan semena semena.",iki kapolri buah sok sok jago tlg tindak i mentang pangkat jabat semena semena,-1,"['iki', 'itu', 'pak', 'kapolri', 'ada', 'buah', 'sok', 'sok', 'jagoan', 'tlg', 'di', 'tindakan', 'lanjut', 'i', 'jangan', 'mentang', 'punya', 'pangkat', 'jabatan', 'semena', 'semena']"
357,Sahman,"Satpamnya nonton , mau narik ngak kena.. malah yg perempuan yg ngejjaga",satpam nonton narik ngak kena perempuan ngejjaga,0,"['satpamnya', 'nonton', 'mau', 'narik', 'ngak', 'kena', 'malah', 'yg', 'perempuan', 'yg', 'ngejjaga']"
