,user,tweet,stem,label,tokenizing
522,Darmansyah Tea,"Di buka infus berdarah itu wajarr, orang dewasa aja suka ada yg berdarah apalagi anak kecil yg lg aktif2 nya",buka infus darah wajarr orang dewasa aja suka darah anak lg aktif,1,"['di', 'buka', 'infus', 'berdarah', 'itu', 'wajarr', 'orang', 'dewasa', 'aja', 'suka', 'ada', 'yg', 'berdarah', 'apalagi', 'anak', 'kecil', 'yg', 'lg', 'aktif', 'nya']"
523,De Li Sa,Arogan banget bapak itu. Kesel aq lihatnya,arogan banget kesel aq lihat,0,"['arogan', 'banget', 'bapak', 'itu', 'kesel', 'aq', 'lihatnya']"
524,Boru Ni Debataraja,Berani nya sm perempuan doang...emang kalo aparat knapa...presiden aja gk se songong ni..,berani sm perempuan doang emang kalo aparat knapa presiden aja gk songong ni,0,"['berani', 'nya', 'sm', 'perempuan', 'doang', 'emang', 'kalo', 'aparat', 'knapa', 'presiden', 'aja', 'gk', 'se', 'songong', 'ni']"
525,Ocy Damanik,"gonikan aja itu pelaku. atau di lagakan sama yg imbang. biar tahu, gimana rasa nya kalau di gitukan.",goni aja laku laga imbang biar gimana gitukan,0,"['gonikan', 'aja', 'itu', 'pelaku', 'atau', 'di', 'lagakan', 'sama', 'yg', 'imbang', 'biar', 'tahu', 'gimana', 'rasa', 'nya', 'kalau', 'di', 'gitukan']"
526,Budi Hehoxs,"Semua tuhh ambik hikmahe,,biar suster melayaninpasien g ledah ledehh",tuhh ambik hikmahe biar suster melayaninpasien ledah ledehh,0,"['semua', 'tuhh', 'ambik', 'hikmahe', 'biar', 'suster', 'melayaninpasien', 'g', 'ledah', 'ledehh']"
527,Ka Sutte,Saya tunggu kabar mewek muak nya ya om tante,tunggu kabar mewek muak ya om tante,0,"['saya', 'tunggu', 'kabar', 'mewek', 'muak', 'nya', 'ya', 'om', 'tante']"
528,Yanto Yanto,Udah usir ajah tu pasen,udah usir ajah pasen,0,"['udah', 'usir', 'ajah', 'tu', 'pasen']"
529,Apoymatic Papahnya Zidane,Kalo ga mau berdarah mah Dukun aje bos biar di sembur ntu bocah yg sakit,kalo ga darah mah dukun aje bos biar sembur ntu bocah sakit,-1,"['kalo', 'ga', 'mau', 'berdarah', 'mah', 'dukun', 'aje', 'bos', 'biar', 'di', 'sembur', 'ntu', 'bocah', 'yg', 'sakit']"
530,Ragil,Sabar jgn jadi sok jago. Sekuat2nya bang jago pasti tersungkur nanti,sabar jgn sok jago kuat bang jago sungkur,-1,"['sabar', 'jgn', 'jadi', 'sok', 'jago', 'sekuatnya', 'bang', 'jago', 'pasti', 'tersungkur', 'nanti']"
531,Meilia Susan,Dikira psang infus cma nempel di kulit,psang infus cma nempel kulit,0,"['dikira', 'psang', 'infus', 'cma', 'nempel', 'di', 'kulit']"
532,Dwi Lestari,"Bodoh sekali keamanan rumah sakit itu,,,,g bisa cm ngatasi satu orang,,,,,,klo gua jadi pimpinan satu udah aku pecat langsung,,,,,",bodoh aman rumah sakit cm ngatasi orang klo gua pimpin udah pecat langsung,-1,"['bodoh', 'sekali', 'keamanan', 'rumah', 'sakit', 'itu', 'g', 'bisa', 'cm', 'ngatasi', 'satu', 'orang', 'klo', 'gua', 'jadi', 'pimpinan', 'satu', 'udah', 'aku', 'pecat', 'langsung']"
533,Yayan Mulyana,Part 2 pasti berisi klarifikasi dan penyesalan,part isi klarifikasi sesal,0,"['part', 'pasti', 'berisi', 'klarifikasi', 'dan', 'penyesalan']"
534,Rasya Kencur,"Halah,.. susternyaa aja kurang ajar,.. emang kebanyakan suster kurang ajar kok",halah susternyaa aja ajar emang banyak suster ajar,1,"['halah', 'susternyaa', 'aja', 'kurang', 'ajar', 'emang', 'kebanyakan', 'suster', 'kurang', 'ajar', 'kok']"
535,Mustofa,"Meskipun kamu benar ,hai keluarga pasien,tapi kamu tetep salah,karna kamu menganiaya secara jelas dan sadar,kalo memang benar dia polisi,pecat aja,nggak becus ngayomi",hai keluarga pasien tetep salah karna aniaya sadar kalo polisi pecat aja nggak becus ngayomi,0,"['meskipun', 'kamu', 'benar', 'hai', 'keluarga', 'pasien', 'tapi', 'kamu', 'tetep', 'salah', 'karna', 'kamu', 'menganiaya', 'secara', 'jelas', 'dan', 'sadar', 'kalo', 'memang', 'benar', 'dia', 'polisi', 'pecat', 'aja', 'nggak', 'becus', 'ngayomi']"
536,Muhammad Naufal,Di sudan sering terjadi,sudan,0,"['di', 'sudan', 'sering', 'terjadi']"
537,Yossy Karnadhy,Kita liat endingnya ........,liat endingnya,0,"['kita', 'liat', 'endingnya']"
538,Eddy Suharto,Paling minta maaf dan kilaf,maaf kilaf,1,"['paling', 'minta', 'maaf', 'dan', 'kilaf']"
539,Anang Fauzi,Rumah sakit itu ngeGaji security buat apaan yak?,rumah sakit ngegaji security yak,-1,"['rumah', 'sakit', 'itu', 'ngegaji', 'security', 'buat', 'apaan', 'yak']"
540,Brian Putra,"Yg jadi pertanyaan kenapa satpamnya diem aja disitu, maju mundur gk berani ambil tindakan lihat perawat sampai nangis""",satpam diem aja situ maju mundur gk berani ambil tindak lihat awat nang,0,"['yg', 'jadi', 'pertanyaan', 'kenapa', 'satpamnya', 'diem', 'aja', 'disitu', 'maju', 'mundur', 'gk', 'berani', 'ambil', 'tindakan', 'lihat', 'perawat', 'sampai', 'nangis']"
541,Zurdhan Gombloh New,BIAR GAK USAH DI INFUS BIAR MATI SEKALIAN KAN BERES,biar infus biar mati beres,-1,"['biar', 'gak', 'usah', 'di', 'infus', 'biar', 'mati', 'sekalian', 'kan', 'beres']"
542,Harry Aksara Yasa,Yang belain bapak ini fix anda sakit jiwa,bain fix sakit jiwa,-1,"['yang', 'belain', 'bapak', 'ini', 'fix', 'anda', 'sakit', 'jiwa']"
543,Benni,"Security rumah sakit,,, security CABE-CABEAN NAMPAKNYA",security rumah sakit security cabe cabe nampaknya,-1,"['security', 'rumah', 'sakit', 'security', 'cabe', 'cabean', 'nampaknya']"
544,Ridho Wijaya,Pasien wajib menunutu perawat itu,pasien wajib menunutu awat,1,"['pasien', 'wajib', 'menunutu', 'perawat', 'itu']"
545,Armya R Ya,Satpam nya pondan,satpam pondan,0,"['satpam', 'nya', 'pondan']"
546,Zack Pae Wulan,Anaknya suru obatin sendri aja dah,anak suru obatin sendri aja dah,0,"['anaknya', 'suru', 'obatin', 'sendri', 'aja', 'dah']"
547,Cintäku Lhuayů Söebélum Bhérkembång,kalao emang benar ucapanya maka hancur citra polisi hanya karena orang berhati buas.,kalao emang ucapanya hancur citra polisi orang hati buas,-1,"['kalao', 'emang', 'benar', 'ucapanya', 'maka', 'hancur', 'citra', 'polisi', 'hanya', 'karena', 'orang', 'berhati', 'buas']"
548,Lina Nurmalita,Apapun itu mslh jgn maen hakim sendiri semua ada etika nya...,apa mslh jgn maen hakim etika,0,"['apapun', 'itu', 'mslh', 'jgn', 'maen', 'hakim', 'sendiri', 'semua', 'ada', 'etika', 'nya']"
549,Raden Adnan,Itu cara cara premanisme yang harus diusut tuntas,preman usut tuntas,0,"['itu', 'cara', 'cara', 'premanisme', 'yang', 'harus', 'diusut', 'tuntas']"
550,Bang Reno,Suruh bawah ke RsHewan aja anakny.dasar Ortu BUNGUL...,suruh rshewan aja anakny dasar ortu bungul,0,"['suruh', 'bawah', 'ke', 'rshewan', 'aja', 'anakny', 'dasar', 'ortu', 'bungul']"
551,Rie Asyarie,"Akhir cerita selesai dg kata ""M A A F "" ..",cerita selesai dg m a a f,0,"['akhir', 'cerita', 'selesai', 'dg', 'kata', 'm', 'a', 'a', 'f']"
552,Ragiel Ramadhan,Gue Polisi...,gue polisi,0,"['gue', 'polisi']"
553,Aprilia Shafira Halimatussa'ban,"Kontrol emosi,,,suster hanya karyawan yg melakukan perintah atasanya,,",kontrol emosi suster karyawan perintah atasanya,0,"['kontrol', 'emosi', 'suster', 'hanya', 'karyawan', 'yg', 'melakukan', 'perintah', 'atasanya']"
554,Angga Yan Raharja,Yg namanya anak kecil dicoblos2 blm tentu dapet infusnya.. Kecuali anakmu diajari macul..,nama anak coblos blm dapet infus kecuali anak ajar macul,0,"['yg', 'namanya', 'anak', 'kecil', 'dicoblos', 'blm', 'tentu', 'dapet', 'infusnya', 'kecuali', 'anakmu', 'diajari', 'macul']"
555,Liank Syah,"Seram bangedd """"""  ,,di tunggu Vidio klarifikasinya",seram bangedd tunggu vidio klarifikasi,-1,"['seram', 'bangedd', 'di', 'tunggu', 'vidio', 'klarifikasinya']"
556,Try Rizky Zeb,"Dak Tek otak,,badan besar otak kurang,infus sendiri anak nya sendiri",dak tek otak badan otak infus anak,0,"['dak', 'tek', 'otak', 'badan', 'besar', 'otak', 'kurang', 'infus', 'sendiri', 'anak', 'nya', 'sendiri']"
557,Widhi Atmoz,"Suruh pulang jgn di layani, bapaknya penjarakan",suruh pulang jgn layan bapak penjara,-1,"['suruh', 'pulang', 'jgn', 'di', 'layani', 'bapaknya', 'penjarakan']"
558,Bagus Najuwa,Naluri seorang ayah...,naluri ayah,0,"['naluri', 'seorang', 'ayah']"
559,Wahyu Allianz,Laporan sj k kantor polisi dan jgn smpe materei 10 rb bsa membuat si kaos merah bebas dr jerat hukum,lapor sj k kantor polisi jgn smpe materei rb bsa si kaos merah bebas dr jerat hukum,0,"['laporan', 'sj', 'k', 'kantor', 'polisi', 'dan', 'jgn', 'smpe', 'materei', 'rb', 'bsa', 'membuat', 'si', 'kaos', 'merah', 'bebas', 'dr', 'jerat', 'hukum']"
560,Endik Soesanto,Part 2 sdh keluar blom ne,part sdh blom ne,0,"['part', 'sdh', 'keluar', 'blom', 'ne']"
561,Jaye Agung Agung,Jangan emosi dong pak ingat ini bulan suci .seharusnya  menahan napsu sabr .,emosi suci tahan napsu sabr,1,"['jangan', 'emosi', 'dong', 'pak', 'ingat', 'ini', 'bulan', 'suci', 'seharusnya', 'menahan', 'napsu', 'sabr']"
562,Raden Kusuma,Tugas keamana mana.. langsung pegang aja...,tugas keamana langsung pegang aja,0,"['tugas', 'keamana', 'mana', 'langsung', 'pegang', 'aja']"
563,Vïñ Ťîêrrâ,Trus klo dia polisi bisa gitu ya marah² jambak² orang.. ya ampun.. susternya jg sdah nangis²..,trus klo polisi gitu ya marah jambak orang ya ampun suster sdah nang,-1,"['trus', 'klo', 'dia', 'polisi', 'bisa', 'gitu', 'ya', 'marah', 'jambak', 'orang', 'ya', 'ampun', 'susternya', 'jg', 'sdah', 'nangis']"
564,K-rim Benzema,"Ujung2nya cuma minta maaf,dah kelar urusan,,,",ujung maaf dah kelar urus,1,"['ujungnya', 'cuma', 'minta', 'maaf', 'dah', 'kelar', 'urusan']"
565,Dibo Boboy,Ditunggu video ejakulasi nya,tunggu video ejakulasi,0,"['ditunggu', 'video', 'ejakulasi', 'nya']"
566,Kurniawan Abdy,Nunggu episod. Yg klarifikasi,nunggu episod klarifikasi,0,"['nunggu', 'episod', 'yg', 'klarifikasi']"
567,Robert Kenedy Ginting,"Terkadang apa yang kita lihat,tak sesuai dengan kejadian ..",terkadang lihat sesuai jadi,1,"['terkadang', 'apa', 'yang', 'kita', 'lihat', 'tak', 'sesuai', 'dengan', 'kejadian']"
568,Ade Ahmad Sabari,Njir mentang2 polusi,njir mentang polusi,-1,"['njir', 'mentang', 'polusi']"
569,Pe Cin Ta Brazzers,"Udah jangan bertele tele, tes urine visum buat laporan kelar.",udah tele tele tes urine visum lapor kelar,0,"['udah', 'jangan', 'bertele', 'tele', 'tes', 'urine', 'visum', 'buat', 'laporan', 'kelar']"
570,Areez Tfc,"Kan ada namanya teguran, ada prosedur utk komplain. Sy kira kita semua bangsa yg beradab. Bkn bar bar",nama tegur prosedur utk komplain sy bangsa adab bkn bar bar,0,"['kan', 'ada', 'namanya', 'teguran', 'ada', 'prosedur', 'utk', 'komplain', 'sy', 'kira', 'kita', 'semua', 'bangsa', 'yg', 'beradab', 'bkn', 'bar', 'bar']"
571,Erwin Triyanto,Ujung2nya minta maaf....,ujung maaf,1,"['ujungnya', 'minta', 'maaf']"
572,Aby,Ada beberapa yang tidak bisa di ajak hukum negara karena ego nya.,ajak hukum negara ego,0,"['ada', 'beberapa', 'yang', 'tidak', 'bisa', 'di', 'ajak', 'hukum', 'negara', 'karena', 'ego', 'nya']"
573,Chris DreGd,Manusia kok senangnya marah2 trus ya,manusia senang marah trus ya,0,"['manusia', 'kok', 'senangnya', 'marah', 'trus', 'ya']"
574,Haris Iskandar,"Mohon pencerahan nya pak kapolri, jika oknum anggota polisi seperti ini....???",mohon cerah kapolri oknum anggota polisi,1,"['mohon', 'pencerahan', 'nya', 'pak', 'kapolri', 'jika', 'oknum', 'anggota', 'polisi', 'seperti', 'ini']"
575,Sunarko Narko,Udh ky anak paud aj klo dilihat yhhhh,udh ky anak paud aj klo yhhhh,0,"['udh', 'ky', 'anak', 'paud', 'aj', 'klo', 'dilihat', 'yhhhh']"
576,Rudi Ziyaads,Polisi ga bermoral....ga pantas dan sudah tidak jamannya lagi bro,polisi ga moral ga jaman bro,0,"['polisi', 'ga', 'bermoral', 'ga', 'pantas', 'dan', 'sudah', 'tidak', 'jamannya', 'lagi', 'bro']"
577,Dewa Ananda Wijaya,Lah yang d masukin jarum infus kan pembuluh darah.. wajar dong kalo keluar darah.. kalo gax pass masuk ke pembuluh darah malah fatal..,d masukin jarum infus buluh darah wajar kalo darah kalo gax pass masuk buluh darah fatal,-1,"['lah', 'yang', 'd', 'masukin', 'jarum', 'infus', 'kan', 'pembuluh', 'darah', 'wajar', 'dong', 'kalo', 'keluar', 'darah', 'kalo', 'gax', 'pass', 'masuk', 'ke', 'pembuluh', 'darah', 'malah', 'fatal']"
578,Khodel Res,"Gk segampang yg bpk kira,,,wajar berdarah",gk gampang bpk wajar darah,0,"['gk', 'segampang', 'yg', 'bpk', 'kira', 'wajar', 'berdarah']"
579,Opank Oded,Mungkin dulu bnyak bolos pas praktek.....,bnyak bolos pas praktek,0,"['mungkin', 'dulu', 'bnyak', 'bolos', 'pas', 'praktek']"
580,J Wahyu S,"+62 beberapa orang. gratis aja galak, apalagi bayar wkwkwkkw",orang gratis aja galak bayar wkwkwkkw,0,"['beberapa', 'orang', 'gratis', 'aja', 'galak', 'apalagi', 'bayar', 'wkwkwkkw']"
581,Ependi Damanik,Serba salah kalau gini.. terkadang juga para Rs sukak buat emosi dengan dan tidak menenpat kan para perawat di posisi yg benar2 di pahami..,serba salah gin terkadang rs sukak emosi menenpat awat posisi paham,-1,"['serba', 'salah', 'kalau', 'gini', 'terkadang', 'juga', 'para', 'rs', 'sukak', 'buat', 'emosi', 'dengan', 'dan', 'tidak', 'menenpat', 'kan', 'para', 'perawat', 'di', 'posisi', 'yg', 'benar', 'di', 'pahami']"
582,Budhi Santoso,CINA SDH BANYAK TINGKAH SKRG,cina sdh tingkah skrg,0,"['cina', 'sdh', 'banyak', 'tingkah', 'skrg']"
583,Blendrang Tewel,Bentar lg mewek2 minta maaf,bentar lg mewek maaf,1,"['bentar', 'lg', 'mewek', 'minta', 'maaf']"
584,Arifuddin,polisi begini yg merusak namax polisi,polisi rusak namax polisi,-1,"['polisi', 'begini', 'yg', 'merusak', 'namax', 'polisi']"
585,AnugrahRaka Pratama,Ujung Ujung ny gek minta maaf..,ujung ujung ny gek maaf,1,"['ujung', 'ujung', 'ny', 'gek', 'minta', 'maaf']"
586,Jakarevo Si Kiroen,Tolong min bapaknya itu di pertemukan dengan aku,tolong min bapak temu,0,"['tolong', 'min', 'bapaknya', 'itu', 'di', 'pertemukan', 'dengan', 'aku']"
587,Kencana,KAOS MERAH.. ANDA TIDAK PANTAS ANIAYA WANITA. MIKIR..!!,kaos merah aniaya wanita mikir,0,"['kaos', 'merah', 'anda', 'tidak', 'pantas', 'aniaya', 'wanita', 'mikir']"
588,Iskandar Zulkarrnin,Lanjut ke meja hijau,meja hijau,0,"['lanjut', 'ke', 'meja', 'hijau']"
589,Dhanny Ramdeey Rama,Sing jelas yg namanya kekerasan iku yow melbu penjara. Kecuali minta maaf terus di maafnooo,sing nama keras iku yow melbu penjara kecuali maaf maafnooo,-1,"['sing', 'jelas', 'yg', 'namanya', 'kekerasan', 'iku', 'yow', 'melbu', 'penjara', 'kecuali', 'minta', 'maaf', 'terus', 'di', 'maafnooo']"
590,Eka Wati,"Jaman skarang banyak para dokter"" yg membunuh pasien tp mn tnggung jawab nya"" sakit biasa di bilang covid di bawa ke rs mesti mati di tempat q bnyak tu sga sja orang kayak gitu kena azap dri allah",jaman skarang dokter bunuh pasien mn tnggung sakit bilang covid bawa rs mesti mati q bnyak sga sja orang kayak gitu kena azap dri allah,-1,"['jaman', 'skarang', 'banyak', 'para', 'dokter', 'yg', 'membunuh', 'pasien', 'tp', 'mn', 'tnggung', 'jawab', 'nya', 'sakit', 'biasa', 'di', 'bilang', 'covid', 'di', 'bawa', 'ke', 'rs', 'mesti', 'mati', 'di', 'tempat', 'q', 'bnyak', 'tu', 'sga', 'sja', 'orang', 'kayak', 'gitu', 'kena', 'azap', 'dri', 'allah']"
591,Prasetyo Bayu P,"Yg pulisi kaos putih pemirsa, bukan yg marah2",pulisi kaos putih pirsa marah,-1,"['yg', 'pulisi', 'kaos', 'putih', 'pemirsa', 'bukan', 'yg', 'marah']"
592,Ari Eko,Nunggu part 2,nunggu part,0,"['nunggu', 'part']"
593,Dedek Arpy,Pasti perwatnya bilang saya maafkan..,perwatnya bilang maaf,1,"['pasti', 'perwatnya', 'bilang', 'saya', 'maafkan']"
594,Agus Susiono,Sesalah2nya perawat bapak jelas ttp salah krna sprti itu.,salah awat ttp salah krna sprti,-1,"['sesalahnya', 'perawat', 'bapak', 'jelas', 'ttp', 'salah', 'krna', 'sprti', 'itu']"
595,Alfa Mandala,Yg sabarrr mas.ojo di bikin emosi nnt menyasal kemudian.,sabarrr mas ojo bikin emosi nnt menyasal,0,"['yg', 'sabarrr', 'mas', 'ojo', 'di', 'bikin', 'emosi', 'nnt', 'menyasal', 'kemudian']"
596,Devid Santoso,Salfok sama security,salfok security,0,"['salfok', 'sama', 'security']"
597,Andre Awan,Pas udah minta maaf kelar kasus nya,pas udah maaf kelar,1,"['pas', 'udah', 'minta', 'maaf', 'kelar', 'kasus', 'nya']"
598,Samsul Hadi,Suruh pasang sndiri saja.,suruh pasang sndiri,0,"['suruh', 'pasang', 'sndiri', 'saja']"
599,Poppy Pratiwie,Pelakunya kaos merah : Jason Tjakrawinata,laku kaos merah jason tjakrawinata,0,"['pelakunya', 'kaos', 'merah', 'jason', 'tjakrawinata']"
600,Nugraha Putra Ciamis,Woy dikira pasien elu aja gak kebayang cape cape kerja tapi di gituin,woy pasien elu aja bayang cape cape kerja gituin,1,"['woy', 'dikira', 'pasien', 'elu', 'aja', 'gak', 'kebayang', 'cape', 'cape', 'kerja', 'tapi', 'di', 'gituin']"
601,Sulis Tyanto,Halah paling ujung²nya klarifikasi minta maaf... tuh si bapak,halah ujung klarifikasi maaf tuh si,1,"['halah', 'paling', 'ujung', 'nya', 'klarifikasi', 'minta', 'maaf', 'tuh', 'si', 'bapak']"
602,Mohammad Abdur Rohim,Infus sendiri aja lu,infus aja lu,0,"['infus', 'sendiri', 'aja', 'lu']"
603,Ahmad Roijad Pulungan,Infus sendri aja d rumh,infus sendri aja d rumh,0,"['infus', 'sendri', 'aja', 'd', 'rumh']"
604,Fahmi Batavia,Lebay bapak baju merah bertopi.. kalo ga ngerti diem aja pak bos.. ga usah maen kasar.. jangan mau damai.. penjarakan.. saksi banyak... Biar kapok.. pake BPJS aje maen kasar,lebay baju merah top kalo ga ngerti diem aja bos ga maen kasar damai penjara saksi biar kapok pake bpjs aje maen kasar,-1,"['lebay', 'bapak', 'baju', 'merah', 'bertopi', 'kalo', 'ga', 'ngerti', 'diem', 'aja', 'pak', 'bos', 'ga', 'usah', 'maen', 'kasar', 'jangan', 'mau', 'damai', 'penjarakan', 'saksi', 'banyak', 'biar', 'kapok', 'pake', 'bpjs', 'aje', 'maen', 'kasar']"
605,Heaven Stricke,Gitu yg laki2 ya tdk brani untuk menolong perawat nya,gitu laki ya brani tolong awat,0,"['gitu', 'yg', 'laki', 'ya', 'tdk', 'brani', 'untuk', 'menolong', 'perawat', 'nya']"
606,Putra Pertama,"Kalo gak ada api ngk mungkin ada asap, ini kejadia jadikanlah sebagi pelajaran untuk perawat dan pelajaran buat kita semua.",kalo api ngk asap kejadia jadi bagi ajar awat ajar,-1,"['kalo', 'gak', 'ada', 'api', 'ngk', 'mungkin', 'ada', 'asap', 'ini', 'kejadia', 'jadikanlah', 'sebagi', 'pelajaran', 'untuk', 'perawat', 'dan', 'pelajaran', 'buat', 'kita', 'semua']"
607,Rheza Alfianda,Udh di tangkap kok pelakunya,udh tangkap laku,0,"['udh', 'di', 'tangkap', 'kok', 'pelakunya']"
608,Arieghan,Palingan klarifikasi nya saya meminta maaf atas perbuatan saya...,paling klarifikasi maaf buat,1,"['palingan', 'klarifikasi', 'nya', 'saya', 'meminta', 'maaf', 'atas', 'perbuatan', 'saya']"
609,Armando Armand,Yang pasti hukum pidana tuh,hukum pidana tuh,-1,"['yang', 'pasti', 'hukum', 'pidana', 'tuh']"
610,Rudhy Retro,Selamat datang di negri +62.....,selamat negri,1,"['selamat', 'datang', 'di', 'negri']"
611,Rohman Saleh,Klo masangnya di hidung ente... Enek dul...... Hadeh,klo masangnya hidung ente enek dul hadeh,0,"['klo', 'masangnya', 'di', 'hidung', 'ente', 'enek', 'dul', 'hadeh']"
612,Mamas Imbil,Buat korban...tuntut dan duitin aja tuh polisi,korban tuntut duitin aja tuh polisi,-1,"['buat', 'korban', 'tuntut', 'dan', 'duitin', 'aja', 'tuh', 'polisi']"
613,Ezen Ali,Menunggu video seterusnya,tunggu video,0,"['menunggu', 'video', 'seterusnya']"
614,Dave Ong,Ujung2 nya mewek minta maaf,ujung mewek maaf,1,"['ujung', 'nya', 'mewek', 'minta', 'maaf']"
615,Joint Tarigan,Makanya tiap pekerjaan perlu profesionalisme,kerja profesionalisme,0,"['makanya', 'tiap', 'pekerjaan', 'perlu', 'profesionalisme']"
616,Arimbi Arimbi Cyantik,Penjarain aja biar tau rasa .itu penganiayaan,penjarain aja biar tau aniaya,0,"['penjarain', 'aja', 'biar', 'tau', 'rasa', 'itu', 'penganiayaan']"
617,Fitri Ani,Nunggu video berikutnya sibotak..kalo ada sertakan dikomentar.,nunggu video sibotak kalo serta komentar,0,"['nunggu', 'video', 'berikutnya', 'sibotak', 'kalo', 'ada', 'sertakan', 'dikomentar']"
618,Mbudi Junkiez,"Kepada bapak aparat mohon ditindaklanjuti nie org stresss, inget perawat itu wanita..ganti tu pake BH ame rok..",aparat mohon ditindaklanjuti nie org stresss inget awat wanita ganti pake bh ame rok,0,"['kepada', 'bapak', 'aparat', 'mohon', 'ditindaklanjuti', 'nie', 'org', 'stresss', 'inget', 'perawat', 'itu', 'wanita', 'ganti', 'tu', 'pake', 'bh', 'ame', 'rok']"
619,J Samosir,Suruh pindah aja..pidana tetap,suruh pindah aja pidana,-1,"['suruh', 'pindah', 'aja', 'pidana', 'tetap']"
620,Jhon Mambas,"Penyidik tdk perlu berkeringat  akan hal ini, Bukti Videoo Jelas, Saksi Buanyak. Tinggal Gasss. Stop Arogansi Aparat, Ingat, Yg Gaji Kau Siapa ??",sidik keringat bukti videoo saksi buanyak tinggal gasss stop arogansi aparat gaji kau,0,"['penyidik', 'tdk', 'perlu', 'berkeringat', 'akan', 'hal', 'ini', 'bukti', 'videoo', 'jelas', 'saksi', 'buanyak', 'tinggal', 'gasss', 'stop', 'arogansi', 'aparat', 'ingat', 'yg', 'gaji', 'kau', 'siapa']"
621,Edward Chandra Palangka Raya,Bapakya itu di kasih obat bius aja keterlaluan,bapakya kasih obat bius aja,0,"['bapakya', 'itu', 'di', 'kasih', 'obat', 'bius', 'aja', 'keterlaluan']"
622,Rifky Hendrito,"Bntar lagi jg minta maaf,,bilang nya khilaf",bntar maaf bilang khilaf,1,"['bntar', 'lagi', 'jg', 'minta', 'maaf', 'bilang', 'nya', 'khilaf']"
623,Feri ZK,Indonesia makin kesini banyak orang gak jelas kayanya.. Makin banyak orang arogan makin banyak orang belaga gila..,indonesia kesini orang kaya orang arogan orang belaga gila,0,"['indonesia', 'makin', 'kesini', 'banyak', 'orang', 'gak', 'jelas', 'kayanya', 'makin', 'banyak', 'orang', 'arogan', 'makin', 'banyak', 'orang', 'belaga', 'gila']"
624,Mellyy Mellyy,Hukum saja ditolong mlah kayak gitu,hukum tolong mlah kayak gitu,0,"['hukum', 'saja', 'ditolong', 'mlah', 'kayak', 'gitu']"
625,Susi Rani,Arogann bngt sih yah pasang inpus ya pasti berdarah kadang Vena nya susah juga wajar lah ..smeena menaa,arogann bngt sih yah pasang inpus ya darah kadang vena susah wajar smeena menaa,-1,"['arogann', 'bngt', 'sih', 'yah', 'pasang', 'inpus', 'ya', 'pasti', 'berdarah', 'kadang', 'vena', 'nya', 'susah', 'juga', 'wajar', 'lah', 'smeena', 'menaa']"
626,Ahsan Alkholikin,Hasil sekolah suap,hasil sekolah suap,0,"['hasil', 'sekolah', 'suap']"
627,G-Heru Cokro Takashi,Kaos merah.... Masukan dulu... Dinginnya malam.,kaos merah masuk dingin malam,-1,"['kaos', 'merah', 'masukan', 'dulu', 'dinginnya', 'malam']"
628,Kherry Kher,"Masya Allah,maha benar netizen dengan segala pendapatnya. Hihihi",masya allah maha netizen dapat hihihi,0,"['masya', 'allah', 'maha', 'benar', 'netizen', 'dengan', 'segala', 'pendapatnya', 'hihihi']"
629,Romi Firnando,Cc Persatuan Perawat Nasional Indonesia,cc satu awat nasional indonesia,0,"['cc', 'persatuan', 'perawat', 'nasional', 'indonesia']"
630,Iwan Fitrawan,Bentar lagi ada yang muncul dengan video muka melas...,bentar muncul video muka melas,0,"['bentar', 'lagi', 'ada', 'yang', 'muncul', 'dengan', 'video', 'muka', 'melas']"
631,Ras Irvan,Palingan tandatangan matre selesai.,paling tandatangan matre selesai,0,"['palingan', 'tandatangan', 'matre', 'selesai']"
632,Edoe Baterek,"Pasti orang kaya baru, kalau ngk orang yang jarang ke rumah sakit karena takut keluar uang,",orang kaya ngk orang jarang rumah sakit takut uang,-1,"['pasti', 'orang', 'kaya', 'baru', 'kalau', 'ngk', 'orang', 'yang', 'jarang', 'ke', 'rumah', 'sakit', 'karena', 'takut', 'keluar', 'uang']"
633,Adang Yasgati,"Tenang banyak duit, dgn cakap maaf, masalah bersih tak bernoda seperti pemutih",tenang duit dgn cakap maaf bersih noda mutih,1,"['tenang', 'banyak', 'duit', 'dgn', 'cakap', 'maaf', 'masalah', 'bersih', 'tak', 'bernoda', 'seperti', 'pemutih']"
634,Sukandi Ji,emang kenapa kalau polisi?,emang polisi,0,"['emang', 'kenapa', 'kalau', 'polisi']"
635,Firdiaz,"Nih materai, 10rb sekarang",materai rb,0,"['nih', 'materai', 'rb', 'sekarang']"
636,Luky Soebrata,Wajar ortu korban ma polisi ada jabatan jadi sekendak ati,wajar ortu korban ma polisi jabat sekendak ati,-1,"['wajar', 'ortu', 'korban', 'ma', 'polisi', 'ada', 'jabatan', 'jadi', 'sekendak', 'ati']"
637,Mauliani Titin,Pak satpam nya takut makanya cuma diliatin,satpam takut diliatin,-1,"['pak', 'satpam', 'nya', 'takut', 'makanya', 'cuma', 'diliatin']"
638,Ihwanun Mudhofir Hariri,Satpamnya kok diem tau keributan gitu langsung sigap harusnya,satpam diem tau ribut gitu langsung sigap,0,"['satpamnya', 'kok', 'diem', 'tau', 'keributan', 'gitu', 'langsung', 'sigap', 'harusnya']"
639,Khodijah,Satpam nya ngapa woilah,satpam ngapa woilah,0,"['satpam', 'nya', 'ngapa', 'woilah']"
640,Tizhy,Awas aja kalau cuma minta maaf doang.,awas aja maaf doang,0,"['awas', 'aja', 'kalau', 'cuma', 'minta', 'maaf', 'doang']"
641,M Tohar Banega,Harus di proses hukum ni orang.,proses hukum ni orang,0,"['harus', 'di', 'proses', 'hukum', 'ni', 'orang']"
642,Prayitno,Wani ne karo suster wedok,wani ne karo suster wedok,0,"['wani', 'ne', 'karo', 'suster', 'wedok']"
643,Pace Yen,Coba langsung di penjara nnti minta maaf muka babingung lagii sudahh aman,coba langsung penjara nnti maaf muka babingung lagi sudahh aman,1,"['coba', 'langsung', 'di', 'penjara', 'nnti', 'minta', 'maaf', 'muka', 'babingung', 'lagii', 'sudahh', 'aman']"
644,Budi Arman,kadang suster banyak gak becus juga...,kadang suster becus,0,"['kadang', 'suster', 'banyak', 'gak', 'becus', 'juga']"
645,Paijin,Tetep satpamnya yang salah.. ngapain malah diem aja dia,tetep satpam salah ngapain diem aja,-1,"['tetep', 'satpamnya', 'yang', 'salah', 'ngapain', 'malah', 'diem', 'aja', 'dia']"
646,DhoniPrtm,Anak magang mungkin:v,anak magang v,0,"['anak', 'magang', 'mungkin', 'v']"
647,Zhen Zen,Mungkin pak polisinya lg banyak cicilan yg belum kebayar dan akhirnya si perwat jadi sasaran amarahnya....sabar mbak....,polisi lg cicil bayar si perwat sasar amarahnya sabar mbak,0,"['mungkin', 'pak', 'polisinya', 'lg', 'banyak', 'cicilan', 'yg', 'belum', 'kebayar', 'dan', 'akhirnya', 'si', 'perwat', 'jadi', 'sasaran', 'amarahnya', 'sabar', 'mbak']"
648,Asep Supriyatna,Klo emng mampu nyembuhin gausah kerumah sakit. Kasih aja bodrek perawat lah jd sasaran,klo emng nyembuhin gausah rumah sakit kasih aja bodrek awat jd sasar,-1,"['klo', 'emng', 'mampu', 'nyembuhin', 'gausah', 'kerumah', 'sakit', 'kasih', 'aja', 'bodrek', 'perawat', 'lah', 'jd', 'sasaran']"
649,Herman Herman,Itu security. Nya kok ngak guna gitu...,security ngak gitu,0,"['itu', 'security', 'nya', 'kok', 'ngak', 'guna', 'gitu']"
650,Chika Alfaris,i jahat kali kok Sampek di Jabak Jabak,i jahat kali sampek jabak jabak,-1,"['i', 'jahat', 'kali', 'kok', 'sampek', 'di', 'jabak', 'jabak']"
